<?xml version="1.0" encoding="UTF-8"?>
<banksData xmlns:cb="http://www.ftn.uns.ac.rs/xws/xsd/cb"
	xmlns:cmn="http://www.ftn.uns.ac.rs/xws/xsd/common" xmlns:xsi="http://www.w3.org/2001/XMLSchema-instance"
	xsi:schemaLocation="http://www.ftn.uns.ac.rs/xws/xsd/cb ../../../WEB-INF/xsd/cb.xsd ">
	<bank>
		<swiftCode>CONARS22</swiftCode>
		<bankClearingAccountNumber>111-1111111111111-11</bankClearingAccountNumber>
		<wsUrl>http://localhost:8080/banka</wsUrl>
		<balance>100000</balance>
	</bank>
	<bank>
		<swiftCode>CONARS23</swiftCode>
		<bankClearingAccountNumber>111-1111111111111-12</bankClearingAccountNumber>
		<wsUrl>http://localhost:8080/banka</wsUrl>
		<balance>10000</balance>
	</bank>
</banksData>
